{
  "$schema": "https://json-schema.org/draft/2020-12/schema",
  "type": "object",
  "additionalProperties": false,
  "required": ["method", "score", "rationale", "strengths", "limitations", "evidence"],
  "properties": {
    "method": {"const": "holistic_anchored_v1"},
    "score": {"type": "integer", "minimum": 1, "maximum": 7},
    "rationale": {"type": "string", "minLength": 1},
    "strengths": {
      "type": "array",
      "minItems": 2,
      "maxItems": 4,
      "items": {"type": "string", "minLength": 1}
    },
    "limitations": {
      "type": "array",
      "maxItems": 4,
      "items": {"type": "string", "minLength": 1}
    },
    "evidence": {
      "type": "array",
      "minItems": 2,
      "maxItems": 5,
      "items": {
        "type": "object",
        "additionalProperties": false,
        "required": ["quote", "explanation"],
        "properties": {
          "quote": {"type": "string", "minLength": 1, "maxLength": 500},
          "explanation": {"type": "string", "minLength": 1}
        }
      }
    }
  }
}
