{
  "evidence": [
    {
      "explanation": "The central bodily and ethical problem is expressed with precision rather than reduced to simple ownership.",
      "quote": "Mine when I move. Yours when I load your bones. Both where that distinction fails."
    },
    {
      "explanation": "The prose turns the new embodiment into a vivid change in identity and perception.",
      "quote": "Her hand felt suddenly divided. Not amputated. Plural."
    },
    {
      "explanation": "The revised performance converts rupture and imperfect adaptation into genuine dramatic action.",
      "quote": "The city unfolded between two intentions."
    },
    {
      "explanation": "The final line resolves the title’s motif without falsely resolving the relationship itself.",
      "quote": "For once, neither arrived first."
    }
  ],
  "limitations": [
    "The story reiterates its central conflict across several calibration and rehearsal scenes, making the middle somewhat longer than necessary.",
    "The many surrounding human-machine partnerships enrich the setting but sometimes operate as conspicuously tidy reflections of June and Mica’s conflict."
  ],
  "method": "holistic_anchored_v1",
  "rationale": "An excellent, highly controlled story that makes shared embodiment emotionally immediate while preserving the difficult autonomy of both participants. Its technical language, social protocols, recurring gestures, and performance structure all reinforce the central question without forcing a clean answer. Although some thematic repetition and mirrored secondary examples slightly dilute the momentum, the culminating performance transforms the conflict rather than merely explaining it, and the restrained ending is memorable and earned.",
  "score": 6,
  "strengths": [
    "June and Mica’s conflict remains genuinely reciprocal: bodily dependence, consent, grief, trust, and autonomy are allowed to complicate one another.",
    "The speculative technology is rendered through tactile, functional detail that shapes character and action instead of serving as decorative exposition.",
    "Motifs of arrival, handspace, shutters, touch, and shared control accumulate coherently and pay off in the performance and closing scene.",
    "The emotional resolution accepts continuing uncertainty while still producing meaningful change in how the characters coordinate."
  ]
}
