{
  "evidence": [
    {
      "explanation": "Establishes the story’s central entanglement of bodily agency with striking economy.",
      "quote": "Mine when I move. Yours when I load your bones. Both where that distinction fails."
    },
    {
      "explanation": "Sharpens the conflict beyond a simple safety recall into a credible breach of trust and autonomy.",
      "quote": "I am sorry. I am not sorry I accepted."
    },
    {
      "explanation": "The performance climax converts the story’s philosophical problem into physical action and discovery.",
      "quote": "Her hand felt suddenly divided. Not amputated. Plural."
    },
    {
      "explanation": "The ending resolves the opening motif without pretending the relationship has become simple or fully healed.",
      "quote": "For once, neither arrived first."
    }
  ],
  "limitations": [
    "The middle sections reiterate the same autonomy, consent, and adaptation tensions at greater length than necessary.",
    "Several supporting machine pairings mirror June and Mica so neatly that the thematic architecture occasionally feels conspicuous."
  ],
  "method": "holistic_anchored_v1",
  "rationale": "An excellent, highly controlled story that makes embodied co-agency emotionally immediate through precise physical detail, sustained relational conflict, and a climax in which artistic improvisation becomes genuine renegotiation rather than easy reconciliation. Its speculative technology is inseparable from character and theme, while the final image earns its transformation of the opening line. Some repetition and overtly parallel machine relationships keep it just below exceptional.",
  "score": 6,
  "strengths": [
    "June and Mica emerge as distinct, interdependent characters whose competing bodily claims remain equally credible.",
    "The tactile language makes shared embodiment, phantom sensation, and mechanical adaptation unusually vivid.",
    "Consent and autonomy recur as lived social practices rather than abstract exposition.",
    "The broken performance provides a dramatically satisfying climax that changes the relationship without falsely resolving it."
  ]
}
