{
  "evidence": [
    {
      "explanation": "The central embodiment problem is articulated with precision and without collapsing either character's claim.",
      "quote": "Mine when I move. Yours when I load your bones. Both where that distinction fails."
    },
    {
      "explanation": "The story gives the bodily transition immediate emotional and sensory force.",
      "quote": "Mica's old body did not contain Mica now. June understood that. Her wrist did not."
    },
    {
      "explanation": "The altered performance converts conflict and failure into genuinely new artistic action.",
      "quote": "Her hand felt suddenly divided. Not amputated. Plural."
    },
    {
      "explanation": "The ending resolves the opening motif through earned mutual adaptation rather than easy reconciliation.",
      "quote": "For once, neither arrived first."
    }
  ],
  "limitations": [
    "The middle is somewhat overextended, revisiting the same autonomy, grief, and calibration conflict through several structurally similar scenes.",
    "The large roster of named, color-coded machines sometimes feels conspicuously designed to echo the central theme, reducing the world’s sense of spontaneity."
  ],
  "method": "holistic_anchored_v1",
  "rationale": "An excellent, highly controlled story whose speculative technology, intimate conflict, performance structure, and recurring motif of who “arrives first” reinforce one another. Its treatment of distributed embodiment, consent, disability, grief, and identity remains emotionally complex rather than becoming a thesis exercise, and the climactic performance transforms the central dispute through action. Some thematic repetition and overpopulation of illustrative machines keep it just short of exceptional compression and force.",
  "score": 6,
  "strengths": [
    "The co-embodiment technology is lucid, tactile, and inseparable from the characters’ emotional lives.",
    "June and Mica’s conflict grants both parties credible autonomy, fault, vulnerability, and irreducible bodily stakes.",
    "The failed performance becomes a convincing dramatic climax rather than a symbolic demonstration with a predetermined answer.",
    "Motifs of anticipation, handspace, social permission, and shared load culminate in a restrained, memorable ending."
  ]
}
